{
  "slug": "game-library",
  "displayName": "ゲームライブラリ",
  "summary": "ゲーム、ハード、セーブデータを管理します。既存URLはそのまま利用できます。",
  "href": "/game-library",
  "image": "./images/pokenaeLogo.png",
  "imageAlt": "",
  "metaLabel": "Google アカウント対応",
  "status": "published",
  "order": 1,
  "tags": [
    "000001",
    "000004"
  ]
}
